{
  "format": "framepulse.media",
  "spec_version": "0.1.0",
  "id": "urn:uuid:c5ee59a6-8c60-412d-9173-080964a3f326",
  "revision": 1,
  "created_at": "2026-09-22T00:00:00Z",
  "updated_at": "2026-09-22T00:00:00Z",
  "asset": {
    "id": "urn:sha256:aaaaaaaaaaaaaaaaaaaaaaaaaaaaaaaaaaaaaaaaaaaaaaaaaaaaaaaaaaaaaaaa",
    "kind": "image",
    "name": "specification-example.png",
    "source": {
      "uri": "https://example.org/specification-example.png",
      "sha256": "aaaaaaaaaaaaaaaaaaaaaaaaaaaaaaaaaaaaaaaaaaaaaaaaaaaaaaaaaaaaaaaa",
      "size_bytes": 100
    },
    "technical": {"width": 640, "height": 360, "duration_us": null, "frame_rate": null, "codec": "PNG", "has_audio": false, "time_base": null}
  },
  "time": {"unit": "microseconds", "origin": "first_presented_frame", "interval": "half-open"},
  "shots": [{
    "id": "urn:uuid:62b11547-304f-4fb0-bd09-bd265da2e02e",
    "index": 1,
    "range": null,
    "boundary": {"method": "image-unit", "confidence": null},
    "keyframes": [{"id": "urn:uuid:7ac879b5-5c03-443d-a56a-358b9ba6d336", "time_us": null, "uri": "frames/image.jpg", "width": 640, "height": 360}],
    "analysis": {"summary": {"value": null, "origin": "inferred", "confidence": null, "evidence_ids": [], "run_id": null, "review_status": "unreviewed"}},
    "emotion": {},
    "regions": [],
    "review": {"state": "unreviewed", "note": ""},
    "status": "measured",
    "warnings": ["This is a structural specification fixture, not a real analyzed asset."]
  }],
  "runs": [],
  "history": [],
  "warnings": ["Example identity, dimensions, size, and URI are illustrative; no media is attached."],
  "extensions": {"example_only": true}
}
